{"schema":"georbf-surfe-golden","schema_version":1,"fixture_id":"schema/identity-minimal","source":{"repository":"https://github.com/MichaelHillier/surfe.git","commit":"290dbe0ab344f4258a4935f05cad0f153f0f69a4","oracle_protocol":"georbf-surfe-oracle","oracle_protocol_version":1},"generation":{"command":["schema-test-only"],"environment":{"OMP_NUM_THREADS":"1","LC_ALL":"C","TZ":"UTC"},"platform":{"os":"schema-test","arch":"schema-test","compiler":"schema-test","libc":"schema-test","endianness":"little"},"precision":{"default":"binary64","anisotropy_intermediate":"binary32","serialization":"max_digits10","matrix_order":"row_major"}},"dataset":{"id":"schema/identity-minimal","description":"Synthetic schema example; not an oracle golden fixture.","coverage":["identity"],"request_line_sha256":"47677e37cef961a08a63f7a6bc8c77e6c8501446636b045bda357acc4b4dd817","response_line_sha256":"57ad0c4970005a8ce1c392aa1b03d4233102cf971d1e3189dacd89b0334af91e"},"comparison":{"default_rule":"exact","numeric_rules":[],"diagnostic_paths":["/expected/error/message"],"weight_policy":"diagnostic_only","error_message_policy":"diagnostic_only","acceptance":{"required_finite":false,"residual_l2_max":null,"relative_residual_max":null,"equality_residual_linf_max":null,"inequality_violation_linf_max":null,"prediction_witnesses_required":false}},"request":{"protocol":"georbf-surfe-oracle","protocol_version":1,"request_id":"schema-example-001","source_commit":"290dbe0ab344f4258a4935f05cad0f153f0f69a4","operation":"identity","input":{},"evidence":[]},"expected":{"protocol":"georbf-surfe-oracle","protocol_version":1,"request_id":"schema-example-001","source":{"repository":"https://github.com/MichaelHillier/surfe.git","commit":"290dbe0ab344f4258a4935f05cad0f153f0f69a4"},"operation":"identity","status":"ok","result":{},"error":null}}
